{
  "schema_version": "1.0.0",
  "generated_at": "2026-09-19T07:10:44.378Z",
  "app_directory": "/home/nyaptor/.jcode/scratch/page-inventory-test/app",
  "pages": [
    {
      "route": "/",
      "source_files": [
        "../../../.jcode/scratch/page-inventory-test/app/page.tsx"
      ],
      "action": [],
      "view_access": []
    },
    {
      "route": "/about",
      "source_files": [
        "../../../.jcode/scratch/page-inventory-test/app/(marketing)/about/page.tsx"
      ],
      "action": [],
      "view_access": []
    },
    {
      "route": "/users/[id]",
      "source_files": [
        "../../../.jcode/scratch/page-inventory-test/app/users/[id]/page.tsx"
      ],
      "action": [],
      "view_access": []
    }
  ]
}
